Ereignisdatum,Ereignisort,Ereignisart,Nummer Se,Datum Veröffentlichung Se,Sicherheitsempfehlungen (Se)
15.03.2006,Gremberg - Köln-Kalk Nord,Zusammenstoß,2007/01,10.12.2007,"Es wird empfohlen alle Stellwerke der Bauform E 43 daraufhin zu überprüfen, ob während der Betriebszeit der Stellwerke technische Änderungen vorgenommen wurden, die zu einer Änderung des unter 3.4.1.2. beschriebenen Regelablaufes geführt haben."
15.03.2006,Gremberg - Köln-Kalk Nord,Zusammenstoß,2007/02,10.12.2007,"Es wird empfohlen geeignete Maßnahmen (z.B. Rücknahme der technischen Änderung) an den Stellwerken vorzunehmen, bei denen die unter 2007/01 beschriebenen Voraussetzungen vorliegen."
20.11.2006,Berlin-Südkreuz,Zusammenstoß,2008/01,19.09.2008,Übersendung des Gutachtens an die S-Bahn Berlin GmbH.
20.11.2006,Berlin-Südkreuz,Zusammenstoß,2008/02,19.09.2008,"Erlass eines Bescheides an die S-Bahn Berlin GmbH mit dem Inhalt, dass sicherzustellen ist, dass die Sandstreueinrichtungen der S-Bahn-Züge der BR 480 und 481 zuverlässig wirken und stets genügend Betriebsstoffe beinhalten (war zu diesem Zeitpunkt bereits erfolgt (siehe Pkt. 6))."
20.11.2006,Berlin-Südkreuz,Zusammenstoß,2008/03,19.09.2008,Überprüfung der Auslegung der Bremsanlage der Fahrzeuge der BR 480/481 in Zusammenarbeit mit Hersteller und Betreiber unter Berücksichtigung der Hinweise des Gutachters (siehe hierzu Pkt. 3.3.4).
20.11.2006,Berlin-Südkreuz,Zusammenstoß,2008/04,19.09.2008,"Erstellung einer Gefährdungsanalyse mit dem Ziel, die hier wahrscheinlich unfallursächliche Kombination „verschmutzter Schienenkopf – geringe Befeuchtung“ präventiv zu bekämpfen bzw. deren Auswirkung durch geeignete betriebliche Maßnahmen zu begrenzen."
26.04.2008,Landrücken Nord - Hartberg,Aufprall,2010/01,14.05.2010,"Zur Erhöhung der Entgleisungssicherheit im Hochgeschwindigkeitsverkehr sollte überprüft werden, ob weiterhin auf eine Einfriedung der Strecke oder Streckenabschnitte verzichtet werden kann bzw. durch andere Maßnahmen gleich gelagerte Ereignisse künftig verhindert werden können."
26.04.2008,Landrücken Nord - Hartberg,Aufprall,2010/02,14.05.2010,Überprüfung und Optimierung der Erkennbarkeit der Fluchtwege und Notfallausrüstung in den Wagen.
26.04.2008,Landrücken Nord - Hartberg,Aufprall,2010/03,14.05.2010,Überarbeitung der Ril 123 bezüglich Modul 123.150 Fremdrettung. Insbesondere ist eine klare Abtrennung der Kompetenzen Notfallmanager/Notfallleitstelle/Einsatzleitung vorzunehmen.
26.04.2008,Landrücken Nord - Hartberg,Aufprall,2010/04,14.05.2010,Überprüfung des betrieblichen Regelwerks hinsichtlich des Verhaltens des Betriebspersonals bei Kollision auf Herdentiere.
26.04.2008,Landrücken Nord - Hartberg,Aufprall,2010/05,14.05.2010,Erneute Einweisung und regelmäßige Unterweisung der zuständigen Rettungskräfte in die Örtlichkeiten und sicherheitstechnischen Einrichtungen sowie Planung und Durchführung von Tunnelrettungsübungen.
16.04.2009,Berlin-Karow,Zusammenstoß,2010/06,08.12.2010,Konkretisierung der Regelungen zum Signalhaltfall bei (Alt)- Stellwerken ohne selbsttätige Gleisfreimeldeanlagen mit dem Ziel diesen so früh wie möglich herbeizuführen.
16.04.2009,Berlin-Karow,Zusammenstoß,2010/07,08.12.2010,Überprüfung der Projektierung des Signalhaltfalles bei vergleichbaren Stellwerken im Bestandsnetz.
16.04.2009,Berlin-Karow,Zusammenstoß,2010/08,08.12.2010,"Überprüfung, ob bei vergleichbaren Bahnhöfen eine selbsttätige Gleisfreimeldeanlage vorgesehen werden sollte."
07.08.2009,Nürnberg-Stein - Hohe Marter,Entgleisung,2011/01,10.02.2011,"Die Sollverspannung der Befestigungsmittel ist ein wesentliches Kriterium der Spurhaltefähigkeit bei Oberbauanlagen und gewährleistet somit die Entgleisungssicherheit. Es wird empfohlen, das oberbautechnische Regelwerk der DB Netz AG hinsichtlich der Inspektion von Gleis- und Weichenanlagen der Oberbauart K-54-B58 zeitnah anzupassen und zu erweitern."
07.08.2009,Nürnberg-Stein - Hohe Marter,Entgleisung,2011/02,10.02.2011,"Festlegung eines abgestuften Inspektionsturnus für die Untersuchung der Verspannung von Befestigungsmitteln in Gleisen und Weichen. Bei der Abstufung sollen Streckengeschwindigkeit/Streckenbelastung sowie exponierte Lagen im Netz (z. B. enge Bögen, Holzschwellengleise mit langer Liegedauer, Oberbauformen mit „indirekter Befestigung“, bei sonstigen Zwangspunkten) berücksichtigt werden."
07.08.2009,Nürnberg-Stein - Hohe Marter,Entgleisung,2011/03,10.02.2011,Festlegung einer Prüfmethode zur Kontrolle des Verspannungszustandes von Befestigungsmitteln sowie von entsprechenden Prüfgrößen. Als geeignete Prüfung wird bspw. die Messung der Sollverspannung mittels Drehmomentschlüssel angesehen.
29.01.2011,Hordorf,Kollision,2011/04,14.09.2011,"Nachrüstung aller Strecken mit Zugbeeinflussung, durch die ein Zug bei unzulässiger Vorbeifahrt an einem Halt zeigenden Signal selbsttätig zum Halten gebracht werden kann, auf Hauptbahnen zusätzlich ein unzulässiges Anfahren gegen Halt zeigende Signale selbsttätig verhindert werden kann."
29.01.2011,Hordorf,Kollision,2011/05,14.09.2011,"Bis zur Nachrüstung der Strecken mit Zugbeeinflussung gemäß lfd. Nr. 1 sollten zusätzliche Maßnahmen getroffen werden, die im jeweiligen Einzelfall geeignet sind, die Eintrittswahrscheinlichkeit und/oder das Schadensausmaß bei einer unzulässigen Vorbeifahrt am Halt zeigenden Signal zu reduzieren."
20.01.2010,Leiferde - Braunschweig Hbf,Kollision,2011/06,20.10.2011,"Um im Notfall eine zügige und sichere Evakuierung von Reisenden zu gewährleisten, sollten die Anforderungen an die Notein- und Notausstiegfenster (NEA) der Komponentenzulassung EBA 05 G 08A (10/05) sowie bauartgleiche NEA hinsichtlich Funktionsfähigkeit (Kennzeichnung, Handhabung und Verletzungsgefahr) überprüft werden."
10.07.2010,Bielefeld Hbf,Störung,2011/07,20.10.2011,"Technische Veränderung der Klimaanlage dahingehend, dass bei einem notwendigen Reset oder Defekt des Heizungs- oder Kälteteiles der Klimaanlage die Frischluftzufuhr und Luftumwälzung im Wagen erhalten bleibt."
27.06.2009,Lövenich - Horrem,Unregelmäßigkeit an Eisenbahnfahrzeugen,2011/08,21.12.2011,"Es sollte mindestens geprüft werden, ob eine Nachrüstung von Leuchtmelder im Blickfeld des Triebfahrzeugführers erforderlich ist, die ihm eine angelegte bzw. nicht vollständig gelöste Zusatzbremse auf dem Steuerwagen signalisiert."
27.06.2009,Lövenich - Horrem,Unregelmäßigkeit an Eisenbahnfahrzeugen,2011/09,21.12.2011,"Es sollte mindestens geprüft werden, ob betriebliche Maßnahmen bis hin zu einem Nutzungsverbot der Zusatzbremse im Fahrbetrieb – Steuerwagen voraus– anzustoßen sind."
28.06.2009,Lövenich - Horrem,Unregelmäßigkeit an Eisenbahnfahrzeugen,2011/10,21.12.2011,Es sollte mindestens geprüft werden ob der Ansaugschacht der Klimaanlage an anderer geeigneten Stelle – außerhalb des Bereichs der Bremsanlage– anzubringen ist.
25.11.2008,Recklinghausen Ost,Einfahrt in besetzten Abschnitt,2012/01,27.02.2012,"Zur Vermeidung „fehlerhafter“ Gleisfreimeldungen durch Gleisstromkreise, sollte mindestens geprüft werden, ob Triebfahrzeugführer, die Lokleerfahrten mit scheibengebremsten Triebfahrzeugen durchführen, den Fahrdienstleiter informieren müssen, wenn Sandstreueinrichtungen bedient oder automatisch ausgelöst wurden und das Triebfahrzeug zum Halten gekommen ist."
01.09.2010,Bacharach,Entgleisung,2012/02,30.05.2012,"Im Rahmen der Betreiberverantwortung der Eisenbahnverkehrsunternehmen ist sicherzustellen, dass die Lastgrenzen bei Güterwagen nicht überschritten werden. Des Weiteren ist sicherzustellen, dass u. a. die Bremsverhältnisse eines Zuges, und zwar in erster Linie die Summe der Bremsgewichte im Verhältnis zum Gesamtgewicht eines Zuges (Bremshundertstel), eingehalten werden. Als ein wesentlicher sicherheitsrelevanter Faktor des Gesamtgewichtes eines Zuges ist das tatsächliche Ladungsgewicht zu ermitteln und entsprechend in die Bremsberechnung einfließen zu lassen."
01.09.2010,Bacharach,Entgleisung,2012/03,30.05.2012," Die Bestimmungen der Ril 408.0581 3 (5) „Notruf“ der Richtlinie „Züge fahren und Rangieren“ mit folgendem Inhalt: „Als Triebfahrzeugführer, der eine durch Notruf eingeleitete Meldung nicht eindeutig aufnehmen oder verstehen kann, müssen Sie die Geschwindigkeit Ihres Zuges sofort auf höchstens 40 km/h verringern und so lange auf Sicht weiter fahren, bis sich aus der anschließenden Meldung ergibt, dass Sie nicht betroffen sind oder bis Sie die Ursache des Notrufes mit dem Fahrdienstleiter geklärt haben“. wurde mit Bekanntgabe 8 – gültig zum 31.12.2009 – neu aufgenommen. Die Elektronische Fahrten-Registrierung des CS 47925 und die Aussage des Triebfahrzeugführers belegen, dass der Triebfahrzeugführer des Zuges CS 47925 nach Erhalt der akustischen Anzeige mit dem Piktogramm „Notrufverbindung“ auf dem GSM-R Fahrzeuggerät bei sofortiger Einleitung einer Schnellbremsung den Halt seines Zuges deutlich vor seinem tatsächlichen Halt hätte ausführen können. In Folge wären die Schäden an der Infrastruktur reduziert und die potenzielle Gefahr, mit einem im Gegengleis fahrenden Zug zu kollidieren, erheblich verringert worden. Unter Berücksichtigung der Entgleisungsfolgen und der potenziellen Gefährdung auch anderer Züge sollten die zum 13.12.2009 geänderten Bestimmung der Ril 408.0581 3 (5) entsprechend angepasst werden."
28.02.2007,Rotenburg (Wümme),Entgleisung,2013/01,15.01.2013,"Unter Berücksichtigung der Feststellungen im Rahmen der Unfalluntersuchung sowie der Erkenntnisse aus dem Gutachten der metallurgischen Untersuchung dürften in Fachkreisen Überlegungen anzustellen sein, ob und inwieweit der Abstand zwischen Heißläuferortungsanlagen (HOA) optimiert werden kann bzw. muss, um dem Umstand sich relativ schnell entwickelnder Heißläufer wirkungsvoller begegnen zu können."
21.09.2011,Bleicherode Ost,Kollision,2013/02,17.04.2013,"Überprüfung, ob in den durchgehenden Hauptgleisen von Bahnhöfen selbsttätige Gleisfreimeldeanlage vorgesehen werden sollten."
11.09.2011,Werlau - St. Goar,Kollision,2013/03,12.06.2013,"In einer Risikobetrachtung sollten die Eintrittswahrscheinlichkeiten und die Mengen künftig zu erwartender Regenspenden (Ereignisauslösende Starkregenfälle) abgeschätzt werden. Im Anschluss daran sollten Gerinne/Entwässerungseinrichtungen nebst zugehörigen Einzugsgebieten einer Überprüfung unterzogen werden mit dem Ziel, weitergehende notwendige Sicherungsmaßnahmen zu identifizieren und umzusetzen."
11.09.2011,Werlau - St. Goar,Kollision,2013/04,12.06.2013,Realisierung einer „anderen Fernsprechverbindung“ gemäß Ril 408.0581 zur Abgabe eines Nothaltauftrages durch Zugpersonale auf Strecken ohne Streckenfernsprecher.
09.01.2013,Espelkamp - Lübbecke (Westf),Bahnübergangsunfall,2013/05,21.06.2013,Die Zeichen der Posten zum Anhalten des Straßenverkehrs sollten auch nach dem Anbringen der Hilfsmittel gegeben werden. Diese Anforderung sollte in der Ril 456 konkretisiert und die eindeutige Verwendung des Begriffs „Hilfsmittel“ in den korrespondierenden Anlagen 2 und 5 überarbeitet werden.
09.01.2013,Espelkamp - Lübbecke (Westf),Bahnübergangsunfall,2013/06,21.06.2013,"Bei planbaren oder länger andauernden Außerbetriebnahmen von BÜSA und Einrichtung einer Sicherung durch Posten, sollte das Risiko einer sicherheitsrelevanten Fehlhandlung des Postens identifiziert werden, um eine akzeptable Maximaldauer der Postensicherung zu ermitteln und künftig festzuschreiben."
09.01.2013,Espelkamp - Lübbecke (Westf),Bahnübergangsunfall,2013/07,21.06.2013,Bei planbaren oder länger andauernden Außerbetriebnahmen sollte eine Abstimmung mit den Verkehrsbehörden (z. B. Sonder- BÜ-Schau) erfolgen.
09.01.2013,Espelkamp - Lübbecke (Westf),Bahnübergangsunfall,2013/08,21.06.2013,"Bei planbaren oder länger andauernden Außerbetriebnahmen sollten mobile Schrankenanlagen mit Lichtzeichen und Halbschranken (z. B. TH BÜP), zur besseren Erkennbarkeit der Postensicherung für den Straßenverkehrsteilnehmer, verstärkt zum Einsatz kommen. In diesem Zusammenhang sollten die Regeln zum Geben der Zeichen angepasst werden."
09.01.2013,Espelkamp - Lübbecke (Westf),Bahnübergangsunfall,2013/09,21.06.2013,"Zum Schutz und zur besseren Erkennbarkeit sollten Posten Warnkleidung mit verbesserter Erkennbarkeit tragen (Klasse 3, mindestens Weste und Hose)."
09.01.2013,Espelkamp - Lübbecke (Westf),Bahnübergangsunfall,2013/10,21.06.2013,Das Abdecken ungültiger Lichtzeichen sollte einheitlich und ausschließlich mit Mitteln entsprechend der Technischen Mitteilung erfolgen. Die Erkennbarkeit der Hilfsmittel sollte verbessert werden.
09.01.2013,Espelkamp - Lübbecke (Westf),Bahnübergangsunfall,2013/11,21.06.2013,"Bei planbaren oder länger andauernden Außerbetriebnahmen sollten während der Dunkelheit verstärkt mobile Beleuchtungseinrichtungen zum Einsatz kommen, wenn dadurch das Einsehen des Kreuzungsbereichs erleichtert wird, auch wenn die Regeln eine BÜ-Beleuchtung bisher nicht vorschrieben."
11.02.2011,Gröbers - Großkugel,Entgleisung,2013/12,24.06.2013,"Die Richtlinie 821.2001 legt hinsichtlich der Standardabweichung s des Gesamtsignals der Längshöhe, der gegenseitigen Höhenlage und der Pfeilhöhe berechnet über 250 m mit einer Schrittweite von 25 m keine Werte fest, bei deren Erreichen zwingend Unterhaltungsmaßnahmen zu erfolgen haben. Eine Überarbeitung sollte dahin gehend erfolgen, dass für die Standardabweichung ebenfalls SR100, SRlim oder Grenzwerte festgesetzt werden."
26.07.2011,Berlin Ostbahnhof,Brandereignis,2013/13,25.11.2013,"Überprüfung, ob für Triebfahrzeuge der baugleichen BR 112, 114 und 143 Maßnahmen zur Erhöhung der Brandsicherheit an den Stromschienen und Fahrmotorklemmstellen (insbesondere der Fahrmotorklemmstelle 1 und 4) zur Vermeidung unzulässig hoher Übergangswiderstände und unterschiedlicher Stromaufteilung vorgesehen werden sollten."
19.12.2012,Düsseldorf-Eller,Bahnübergangsunfall,2014/01,07.04.2014,"Im Rahmen der Planung und Zulassung von BÜSA, sollte im Ergebnis einer Risikobetrachtung die Anwendung der technischen BÜ-Sicherungen gem. § 11 Abs. 6 EBO konkretisiert und – mit der Zielstellung Schadensausmaße aufgrund liegengebliebener Fahrzeuge im Gefahrenraum des BÜ möglichst zu minimieren – modifiziert werden."
24.07.2012,Stuttgart Hbf,Entgleisung,2014/02,08.04.2014,"Überarbeitung und Konkretisierung der Ril 800.0110 und 800.0120 mit dem Ziel, Trassierungen außerhalb von Regelwerten und Sollvorgaben stärker zu reglementieren."
29.09.2012,Stuttgart Hbf,Entgleisung,2014/02,08.04.2014,"Überarbeitung und Konkretisierung der Ril 800.0110 und 800.0120 mit dem Ziel, Trassierungen außerhalb von Regelwerten und Sollvorgaben stärker zu reglementieren."
24.07.2012,Stuttgart Hbf,Entgleisung,2014/03,08.04.2014,"Weitergehende Untersuchungen zur generellen Überprüfung der uneingeschränkten Eignung der Pufferbauart an langen Reisezugwagen im Schiebebetrieb unter besonderer Berücksichtigung der auftretenden Verspannkräfte und aller möglichen Randparameter im Netz. Sollte dieser Nachweis nicht zu führen sein, wird empfohlen diese Pufferbauart an langen Reisezugwagen im Schiebebetrieb nicht mehr zum Einsatz zu bringen."
29.09.2012,Stuttgart Hbf,Entgleisung,2014/03,08.04.2014,"Weitergehende Untersuchungen zur generellen Überprüfung der uneingeschränkten Eignung der Pufferbauart an langen Reisezugwagen im Schiebebetrieb unter besonderer Berücksichtigung der auftretenden Verspannkräfte und aller möglichen Randparameter im Netz. Sollte dieser Nachweis nicht zu führen sein, wird empfohlen diese Pufferbauart an langen Reisezugwagen im Schiebebetrieb nicht mehr zum Einsatz zu bringen."
13.04.2012,Mühlheim (Main) Ost Üst - Hanau Hbf,Kollision,2014/04,15.07.2014,Konkretisierung der Regelungen für das Ein- und Ausgleisen von Zweiwegefahrzeugen auf der freien Strecke insbesondere der örtlichen Einweisung der Verantwortlichen.
26.10.2013,Gladbeck West,Kollision,2014/05,28.11.2014,"Minimierung des gegenwärtigen Verfahrens „Bremsprobeberechtigter am Zug“ auf ein absolut notwendiges Maß (Notfall, z. B. nach Störung während einer Zugfahrt, die eine Bremsprobe erforderlich macht)."
26.10.2013,Gladbeck West,Kollision,2014/06,28.11.2014,Mittel- und langfristig sollten technische Einrichtungen zur sicheren Durchführung von Bremsproben im europaweiten Güterverkehr zur Minimierung der menschlichen Fehlerrate zum Einsatz kommen.
01.08.2014,Mannheim Hbf,Kollision,2015/01,24.09.2015,Das Bewusstsein und die Kompetenz der Triebfahrzeugpersonale im Umgang mit PZBZwangsbremsungen jeglicher Art durch gezielte Trainingsmaßnahmen kontinuierlich zu stärken.
01.08.2014,Mannheim Hbf,Kollision,2015/02,24.09.2015,"Die Nachrüstung der fahrzeugseitigen Zugbeeinflussungseinrichtungen mit dem Schutzziel „eine Verbindungsaufnahme nach PZB-Zwangsbremsungen vor einer Wiederanfahrt herzustellen“, zu überprüfen und in Abhängigkeit des Ergebnisses weiterzuentwickeln."
17.07.2009,Bruchmühlen - Bünde (Westf),Entgleisung,2015/03,04.12.2015,Zur Vermeidung eines weiteren Heißläufer bedingten Radsatzwellenbruches werden gegenwärtig folgende fahrzeugseitigen Maßnahmen empfohlen: Austausch vernieteter Messingkäfige durch Lagerkäfige aus Kunststoff.
17.07.2009,Bruchmühlen - Bünde (Westf),Entgleisung,2015/04,04.12.2015,"Überprüfung, ob der Anbau von Entgleisungsdetektoren bzw. Sensoren zur Heißläufererkennung zu einer messbaren Erhöhung der Entgleisungssicherheit beitragen können."
25.04.2015,Wilhelmshaven,Brandereignis,2016/01,07.06.2016,Einsatz von nicht entflammbarem und verschleißfestem Material für die Diesel-Leckleitung unter Angabe einer max. Verwendungsdauer vorsehen. Brandverhindernde Maßnahmen am Turbolader und Abgasrohr durchführen. Konstruktive Anpassung der Kraftstoffrückführung vornehmen.
25.04.2015,Wilhelmshaven,Brandereignis,2016/02,07.06.2016,Nachrüstung von Branddetektoren mit automatischer Motorabschaltung bei allen Dieseltriebzügen der Bauart LINT.
09.02.2016,Bad Aibling - Kolbermoor,Kollision,2017/01,07.02.2017,Es wird empfohlen den „Zugfunknotruf“ und den „Notruf-Strecke“ im Auswahlmenü des Gefo nach Betätigung der Taste Notruf beim Fdl in einer Funktionstaste zusammenzuführen.
09.06.2013,Kaub - Lorch (Rhein) Üst,Entgleisung,2017/02,10.02.2017,"Entwässerungsanlagen im Gleis sowie in Gleisnähe können bei Funktionsstörungen zur Durchfeuchtung des Gleisunterbaus führen, woraus sich als Folge betriebsgefährdende Gleislagefehler entwickeln können. Den für die Inspektion von Entwässerungsanlagen eingesetzten Personalen fehlt ein flächendeckendes Kataster über die vorhandenen Entwässerungsanlagen, um regelmäßige Inspektionen planen und durchführen zu können. Es wird empfohlen alle Entwässerungsanlagen separat zu erfassen, um regelmäßige Inspektionen auf Funktionsfähigkeit der jeweiligen Entwässerungsanlage zu planen und zeitnah durchführen zu können. Ziel dieser Maßnahme ist die vollständige und regelmäßige Kontrolle der Entwässerungsanlagen im Gleis sowie in Gleisnähe, um die Entwicklung von betriebsgefährdenden Gleislagefehlern, die aus der Durchfeuchtung des Gleisunterbaus entstehen können, zu verhindern."
09.06.2013,Kaub - Lorch (Rhein) Üst,Entgleisung,2017/03,10.02.2017,"Gleislagestörungen werden gemäß Ril 821.2001 Abschnitt 5 nach Einzelfehlern beurteilt, wobei kombiniert auftretende Einzelfehler besonders zu betrachten sind. Unter diesen kombiniert auftretenden Einzelfehlern sind auch kurz hintereinander folgende, also zyklische, Längshöhenfehler einzustufen. In Ril 821.1000 Abschnitt 2 und in Ril 821.2001 Tabelle 2 sind Beurteilungsmaßstäbe für Einzelfehler nach der Störgröße/Reaktion (SR) Logik definiert und in den folgenden Abschnitten anzuwendende Handlungsanweisungen für den Anlagenverantwortlichen (ALV) hinterlegt. Für kombiniert auftretende Einzelfehler fehlen konkrete Handlungsanweisungen. Der ALV wird gemäß Ril 821 aufgefordert, kombiniert auftretende Gleislagefehler besonders zu berücksichtigen und nach eigenem Ermessen zu handeln. Es wird empfohlen, das Regelwerk hinsichtlich der kombiniert auftretenden Einzelfehler zu präzisieren."
01.02.2017,Gruiten,Störung,2017/04,12.09.2017,"Die Sicherheitsbehörde sollte das betriebliche Regelwerk der DB Netz AG hinsichtlich des Themas „Abschnittsprüfung“ auf dessen Anwendungssicherheit überprüfen und ggf. auf Änderungen hinwirken, die etwaige Fehlinterpretationen durch den Anwender möglichst ausschließen."
11.09.2015,Duisburg-Wedau - Lintorf (Bz. Düsseldorf),Entgleisung,2017/05,20.12.2017,"Die Tf sollten im Rahmen der regelmäßigen Fortbildung und Überwachung bzw. durch andere geeignete Mittel zur strikten Einhaltung der Regeln im Zusammenhang mit Unregelmäßigkeiten an Fahrzeugen und Ladungen und den Maßnahmen bei drohender Gefahr angehalten werden. Hinsichtlich des Erkennens und Behebens von Wagenstörungen durch Tf sollte eine deutliche Verbesserung der Arbeitsausführung angestrebt werden. Die Tf sollten zur Bedeutung dieser Tätigkeiten besonders sensibilisiert werden, da unerkannte Störungen an den Fahrzeugen wegen oft nichtvorhandener Rückfalleben fast zwangsläufig zu schweren Unfällen führen."
11.09.2015,Duisburg-Wedau - Lintorf (Bz. Düsseldorf),Entgleisung,2017/06,20.12.2017,"Die Qualitätsprüfung bei der Instandhaltung, entsprechend Unterstützungsprozess, U7.2.4.2 ist ggf. zu optimieren. Es ist dafür zur sorgen, dass zur Befundung von Radsätzen nur Mitarbeiter mit der nötigen Qualifikation zum Einsatz kommen und die Weisung DB Schenker Rail AG IWC(W)2014/10 strikt eingehalten wird."
11.09.2015,Duisburg-Wedau - Lintorf (Bz. Düsseldorf),Entgleisung,2017/07,20.12.2017,Die Fdl sollten im Rahmen der regelmäßigen Fortbildung und Überwachung zur strikten Einhaltung der Regeln 408.0553 und 408.0581 angehalten werden.
30.06.2017,Leese-Stolzenau,Kollision,2018/01,07.02.2018,"Bahnhöfe, die bisher über keine selbsttätige Gleisfreimeldeanlagen verfügen, sollten dahingehend einer Risikobetrachtung unterzogen werden. Im Ergebnis dessen sollten die Hauptglei-se dieser Bahnhöfe entsprechend der Risikoklassifizierung sukzessive mit einer selbsttätigen Gleisfreimeldeanlage nachgerüstet werden."
09.02.2016,Bad Aibling - Kolbermoor,Kollision,2018/02,29.10.2018,"Hinsichtlich der Nachrüstung der Erlaubnisabhängigkeit bei Zb 65 ohne Selbstblockstreckengruppe wird empfohlen, das einschlägige Regelwerk gesamthaft zu überprüfen und im Zuge einer Risikoabschätzung verbindliche Vorgaben zur Nachrüstung von Bestandsstellwerken zu treffen."
09.02.2016,Bad Aibling - Kolbermoor,Kollision,2018/03,29.10.2018,"Es wird empfohlen, das Regelwerk insbesondere hinsichtlich folgender Punkte zu optimieren: Regeln zur Störungsidentifikation erstellen, Regeln für die Anwendung von „Fahrstraßentechnik als Streckensicherung“ erstellen, Regeln für die Räumungsprüfung auf eingleisigen Strecken und bei Gleiswechselbetrieb überarbeiten und präzisieren."
09.02.2016,Bad Aibling - Kolbermoor,Kollision,2018/04,29.10.2018,"Auf Grundlage einer Risikobetrachtung wird empfohlen, die Umstellung des funktionsorientierten Regelwerks zum prozessorientierten Regelwerk zu überprüfen."
09.02.2016,Bad Aibling - Kolbermoor,Kollision,2018/05,29.10.2018,"Es wird empfohlen, bei Trainings-und Schulungsmaßnahmen verstärkt auf Stellwerksimulatoren zurückzugreifen und auch die Aspekte Unterforderung, neue Medien und Ablenkung aufzugreifen."
09.02.2016,Bad Aibling - Kolbermoor,Kollision,2018/06,29.10.2018,"Auf Grundlage einer Risikobetrachtung wird empfohlen, die gegenwärtige Anschaltbarkeit des Ersatzsignals Zs 1 kritisch zu hinterfragen und diese mit risikominimierenden betrieblichen und/oder technischen Bedingungen zu untersetzen."
15.05.2017,Neustadt a Rübenberge - Hagen (Han),Bahnübergangsunfall,2018/07,29.05.2018,"Die Sicherung eines BÜ durch BÜP stellt auf Grund der Tatsache, dass der Fehler eines Einzelnen unmittelbar zu einem Unfall führen kann, ein erhöhtes Risiko dar. Deshalb sollte die Entwicklung und der Einsatz technischer Lösungen, wie z.B. das NWS, zur Minimierung der Risiken zügig vorangetrieben werden."
15.05.2017,Neustadt a Rübenberge - Hagen (Han),Bahnübergangsunfall,2018/08,29.05.2018,"Das Verfahren der Selbstbestimmung des Sicherungszeitpunkts durch den BÜP sollte restriktiver zum Einsatz kommen, bzw. in begründeten Fällen sollte dieses Verfahren durch klare Zeitvorgaben, wann der BÜ zu sichern ist, ersetzt werden."
15.05.2017,Neustadt a Rübenberge - Hagen (Han),Bahnübergangsunfall,2018/09,29.05.2018,Die strikte Einhaltung der Regeln 456.0020 Abs. 4 (3) sollte im Rahmen der Einweisung und Lehrgespräche am Arbeitsplatz der BÜP grundsätzlich thematisiert und überwacht werden.
15.05.2017,Neustadt a Rübenberge - Hagen (Han),Bahnübergangsunfall,2018/10,29.05.2018,Die Einhaltung vorgeschriebener Wortlaute im Rahmen von Meldungen und Aufträgen und die Wahrung einer generellen Fernsprechdisziplin sollten noch stärker in das Bewusstsein der Beteiligten gerückt werden und durch Auswertung aufgezeichneter GSM-R-Gespräche regelmäßig geprüft werden.
15.05.2017,Neustadt a Rübenberge - Hagen (Han),Bahnübergangsunfall,2018/11,29.05.2018,"Der Infrastrukturbetreiber sollte Mindestanforderungen an die Gestaltung der BÜP-Arbeitsplätze definieren, die der Arbeitsaufgabe der BÜP gerecht werden. Der jeweilige Arbeitgeber hat im Rahmen seiner Arbeitgeberpflichten mindestens diese Mindestanforderungen umzusetzen. Der Infrastrukturbetreiber sollte diese Arbeitsplätze engmaschig kontrollieren."
